,A,B,C,D,E,Reponse,Reponse_preprocess,file
1,A. Recours abusif et inapproprié aux antimicrobiens,B. Forte progression d’infections émergentes,C. Manque de nouveaux traitements antimicrobiens,D. Prévention insuffisante contre les infections,"E. Les propositions A, B, C et D sont fausses",Réponse : ACD,"['A', 'C', 'D']",data_txt/chapitre3
2,A. L’encadrement de la délivrance par les pharmaciens,B. La surveillance de la résistance aux antimicrobiens dans les établissements de soins,C. La formation des professionnels de santé,D. L’interdiction des antimicrobiens en médecine vétérinaire,"E. Les propositions A, B, C et D sont fausses",Réponse : BC,"['B', 'C']",data_txt/chapitre3
3,A. Réagir,B. Déceler,C. Évaluer,D. Faire connaître,"E. Les propositions A, B, C et D sont fausses",Réponse : BCD,"['B', 'C', 'D']",data_txt/chapitre3
4,A. La coordination de la recherche de nouveaux vaccins,B. La lutte contre les infections liées aux soins,C. La surveillance épidémiologique,D. La coopération étroite avec l’OMS,"E. Les propositions A, B, C et D sont fausses",Réponse : C,['C'],data_txt/chapitre3
5,A. Les incitations à la vaccination,B. La supervision des laboratoires de production des vaccins,C. La diffusion de messages clairs et sérieux,D. Le partage des meilleures pratiques d’encouragement à la vaccination,"E. Les propositions A, B, C et D sont fausses",Réponse : CD,"['C', 'D']",data_txt/chapitre3
6,A. 50%,B. 80%,C. 75%,D. 65%,"E. Les propositions A, B, C et D sont fausses",Réponse : C,['C'],data_txt/chapitre3
7,A. Le cancer du sein,B. Le cancer de la prostate,C. Le cancer colorectal,D. Le cancer du col de l’utérus,"E. Les propositions A, B, C et D sont fausses",Réponse : ACD,"['A', 'C', 'D']",data_txt/chapitre3
8,A. Le respect de l’autonomie des patients,B. Le meilleur accompagnement de la fin de vie,C. L’assistance aux aidants familiaux des malades,D. Le respect de la dignité des patients,"E. Les propositions A, B, C et D sont fausses",Réponse : D,['D'],data_txt/chapitre3
9,A. 5.000,B. 2.500,C. 8.000,D. 6.000,"E. Les propositions A, B, C et D sont fausses",Réponse : D,['D'],data_txt/chapitre3
